Cherry Crumble	Buttery Ice Cream with Cherries & Swirls of Oat Crumble	https://www.benjerry.com/files/live/sites/systemsite/files/flavors/products/us/pint/open-closed-pints/cherry-crumble-landing-open.png
Dublin Mudslide	Irish Cream Ice Cream with Chocolate Chocolate Chip Cookies & Coffee Fudge Swirls	https://www.benjerry.com/files/live/sites/systemsite/files/flavors/products/us/pint/open-closed-pints/dublin-mudslide-landing-open.png
Change is Brewing	Cold Brew Coffee Ice Cream with Marshmallow Swirls & Fudge Brownies	https://www.benjerry.com/files/live/sites/systemsite/files/flavors/products/us/pint/open-closed-pints/change-is-brewing-landing-open.png
Chewy Gooey Cookie​	Milk Chocolate & Coconut Ice Creams with Fudge Flakes, Shortbread Cookies & Caramel Swirls	https://www.benjerry.com/files/live/sites/systemsite/files/flavors/products/us/pint/open-closed-pints/chewy-gooey-cookie-landing-open.png
Mint Chocolate Chance™	Mint Ice Cream Loaded with Fudge Brownies	https://www.benjerry.com/files/live/sites/systemsite/files/flavors/products/us/pint/open-closed-pints/mint-chocolate-chance-landing-open.png
Dirt Cake	Vanilla Pudding Ice Cream with Chocolate Sandwich Cookies & Chocolate Cookie Swirls Topped with Milk Chocolatey Ganache & Chocolate Cookie Crumble	https://www.benjerry.com/files/live/sites/systemsite/files/flavors/products/us/pint/open-closed-pints/dirt-cake-topped-landing-open.png
Chocolate Milk & Cookies	Chocolate Ice Cream with Chocolate Chip Cookies & Chocolate Cookie Swirls Topped with Milk Chocolatey Ganache & Fudge Chips	https://www.benjerry.com/files/live/sites/systemsite/files/flavors/products/us/pint/open-closed-pints/chocolate-milk-cookies-topped-landing-open.png
Americone Dream®	Vanilla Ice Cream with Fudge-Covered Waffle Cone Pieces & a Caramel Swirl	https://www.benjerry.com/files/live/sites/systemsite/files/flavors/products/us/pint/open-closed-pints/americone-dream-landing-open.png
Brewed to Matter™	Coffee Ice Cream with Fudge Chunks & a Brownie Batter Swirl	https://www.benjerry.com/files/live/sites/systemsite/files/flavors/products/us/pint/open-closed-pints/brewed-to-matter-landing-open.png
Cannoli	Mascarpone Ice Cream with Fudge-Covered Pastry Shell Pieces & Mascarpone Swirls	https://www.benjerry.com/files/live/sites/systemsite/files/flavors/products/us/pint/open-closed-pints/cannoli-landing-open.png
Caramel Chocolate Cheesecake	Caramel Cheesecake Ice Cream with Cheesecake Pieces & Chocolate Cookie Swirls	https://www.benjerry.com/files/live/sites/systemsite/files/flavors/products/us/pint/open-closed-pints/caramel-chocolate-cheesecake-landing-open.png
Cherry Garcia®	Cherry Ice Cream with Cherries & Fudge Flakes	https://www.benjerry.com/files/live/sites/systemsite/files/flavors/products/us/pint/open-closed-pints/cherry-garcia-landing-open.png
Chocolate Chip Cookie Dough	Vanilla Ice Cream with Gobs of Chocolate Chip Cookie Dough	https://www.benjerry.com/files/live/sites/systemsite/files/flavors/products/us/pint/open-closed-pints/choc-chip-cookie-dough-landing-open.png
Chocolate Fudge Brownie	Chocolate Ice Cream with Fudge Brownies	https://www.benjerry.com/files/live/sites/systemsite/files/flavors/products/us/pint/open-closed-pints/chocolate-fudge-brownie-landing-open.png
Chocolate Peanut Butter Split	Chocolate & Banana Ice Creams with Mini Peanut Butter Cups	https://www.benjerry.com/files/live/sites/systemsite/files/flavors/products/us/pint/open-closed-pints/chocolate-peanut-butter-split-landing-open.png
Chocolate Shake It™	Chocolate Malt Milkshake Ice Cream With Salted Fudge Pieces & Marshmallow Swirls	https://www.benjerry.com/files/live/sites/systemsite/files/flavors/products/us/pint/open-closed-pints/chocolate-shake-it-landing-open.png
Chocolate Therapy®	Chocolate Ice Cream with Chocolate Cookies & Swirls of Chocolate Pudding Ice Cream	https://www.benjerry.com/files/live/sites/systemsite/files/flavors/products/us/pint/open-closed-pints/chocolate-therapy-landing-open.png
Chubby Hubby®	Vanilla Malt Ice Cream with Peanutty Fudge-Covered 
Pretzels with Fudge & Peanut Buttery Swirls	https://www.benjerry.com/files/live/sites/systemsite/files/flavors/products/us/pint/open-closed-pints/chubby-hubby-landing-open-2019.png
Chunky Monkey®	Banana Ice Cream with Fudge Chunks & Walnuts	https://www.benjerry.com/files/live/sites/systemsite/files/flavors/products/us/pint/open-closed-pints/chunky-monkey-landing-open.png
Cinnamon Buns®	Caramel Ice Cream with Cinnamon Bun Dough & a Cinnamon Streusel Swirl	https://www.benjerry.com/files/live/sites/systemsite/files/flavors/products/us/pint/open-closed-pints/cinnamon-buns-landing-open-2019.png
Coffee Coffee BuzzBuzzBuzz!®	Coffee Ice Cream with Espresso Bean Fudge Chunks	https://www.benjerry.com/files/live/sites/systemsite/files/flavors/products/us/pint/open-closed-pints/coffee-coffee-buzz-landing-open.png
Coffee Toffee Bar Crunch	Coffee Ice Cream with Fudge-Covered Toffee Pieces	https://www.benjerry.com/files/live/sites/systemsite/files/flavors/products/us/pint/open-closed-pints/coffee-toffee-landing-open.png
Everything But The...®	A Collision of Chocolate & Vanilla Ice Creams mixed with Peanut Butter Cups, Fudge-Covered Toffee Pieces, White Chocolatey Chunks & Fudge-Covered Almonds	https://www.benjerry.com/files/live/sites/systemsite/files/flavors/products/us/pint/open-closed-pints/everything-but-the-landing-open.png
Gimme S’more!™	Toasted Marshmallow Ice Cream with Chocolate Cookie Swirls, Graham Cracker Swirls & Fudge Flakes	https://www.benjerry.com/files/live/sites/systemsite/files/flavors/products/us/pint/open-closed-pints/gimme-smore-landing-open-new.png
Glampfire Trail Mix™	Chocolate Ice Cream with Crunchy Pretzel Swirls, Marshmallow Swirls & Fudge-Covered Almonds	https://www.benjerry.com/files/live/sites/systemsite/files/flavors/products/us/pint/open-closed-pints/glampfire-trail-mix-landing-open.png
Go-To Cold Brew™	Cold Brew & Sweet Cream Ice Creams with Salted Caramel Swirls	https://www.benjerry.com/files/live/sites/systemsite/files/flavors/products/us/pint/open-closed-pints/go-to-cool-brew-landing-open.png
Half Baked®	Chocolate & Vanilla Ice Creams mixed with Gobs of Chocolate Chip Cookie Dough & Fudge Brownies	https://www.benjerry.com/files/live/sites/systemsite/files/flavors/products/us/pint/open-closed-pints/half-baked-landing-open.png
Ice Cream Sammie	Vanilla Ice Cream with Chocolate Sandwich Cookies & Chocolate Cookie Swirls 	https://www.benjerry.com/files/live/sites/systemsite/files/flavors/products/us/pint/open-closed-pints/ice-cream-sammie-landing-open.png
Milk & Cookies	Vanilla Ice Cream with a Chocolate Cookie Swirl, Chocolate Chip & Chocolate Chocolate Chip Cookies	https://www.benjerry.com/files/live/sites/systemsite/files/flavors/products/us/pint/open-closed-pints/milk-and-cookies-landing-open.png
Mint Chocolate Cookie	Peppermint Ice Cream with Chocolate Sandwich Cookies	https://www.benjerry.com/files/live/sites/systemsite/files/flavors/products/us/pint/open-closed-pints/mint-chocolate-cookie-landing-open.png
Minter Wonderland™	Dark Chocolate Mint Ice Cream with Marshmallow Swirls & Chocolate Cookie Swirls	https://www.benjerry.com/files/live/sites/systemsite/files/flavors/products/us/pint/open-closed-pints/minter-wonderland-landing-open.png
Netflix & Chilll'd™	Peanut Butter Ice Cream with Sweet & Salty Pretzel Swirls & Fudge Brownies	https://www.benjerry.com/files/live/sites/systemsite/files/flavors/products/us/pint/open-closed-pints/netflix-chilld-landing-open.png
New York Super Fudge Chunk®	Chocolate Ice Cream with White & Dark Fudge Chunks, Pecans, Walnuts & Fudge-Covered Almonds	https://www.benjerry.com/files/live/sites/systemsite/files/flavors/products/us/pint/open-closed-pints/new-york-super-fudge-landing-open.png
Oat of This Swirled™	Buttery Brown Sugar Ice Cream with Fudge Flakes & Oatmeal Cinnamon Cookie Swirls	https://www.benjerry.com/files/live/sites/systemsite/files/flavors/products/us/pint/open-closed-pints/oat-of-this-world-landing-open.png
Peanut Butter Cup	Peanut Butter Ice Cream with Peanut Butter Cups	https://www.benjerry.com/files/live/sites/systemsite/files/flavors/products/us/pint/open-closed-pints/peanut-butter-cup-landing-open.png
Peanut Butter Half Baked®	Chocolate & Peanut Butter Ice Creams Mixed with Gobs of Peanut Butter Cookie Dough & Fudge Brownies	https://www.benjerry.com/files/live/sites/systemsite/files/flavors/products/us/pint/open-closed-pints/peanut-butter-half-baked-landing-open.png
Peanut Butter World®	Milk Chocolate Ice Cream with Peanut Buttery Swirls & Chocolate Cookie Swirls	https://www.benjerry.com/files/live/sites/systemsite/files/flavors/products/us/pint/open-closed-pints/peanut-butter-world-landing-open.png
Phish Food®	Chocolate Ice Cream with Gooey Marshmallow Swirls, Caramel Swirls & Fudge Fish	https://www.benjerry.com/files/live/sites/systemsite/files/flavors/products/us/pint/open-closed-pints/phish-food-landing-open-new.png
Pistachio Pistachio	Pistachio Ice Cream with Lightly Roasted Pistachios	https://www.benjerry.com/files/live/sites/systemsite/files/flavors/products/us/pint/open-closed-pints/pistachio-pistachio-landing-open-2019.png
Pumpkin Cheesecake	Pumpkin Cheesecake Ice Cream with a Graham Cracker Swirl	https://www.benjerry.com/files/live/sites/systemsite/files/flavors/products/us/pint/open-closed-pints/pumpkin-cheesecake-landing-open.png
Salted Caramel Almond	Vanilla  Bean Ice Cream with Roasted Almond Slivers, Fudge Flakes & a Salted Caramel Swirl	https://www.benjerry.com/files/live/sites/systemsite/files/flavors/products/us/pint/open-closed-pints/salted-caramel-almond-landing-open.png
Strawberry Cheesecake	Strawberry Cheesecake Ice Cream with Strawberries & a Thick Graham Cracker Swirl	https://www.benjerry.com/files/live/sites/systemsite/files/flavors/products/us/pint/open-closed-pints/strawberry-cheesecake-landing-open.png
The Tonight Dough®	Caramel & Chocolate Ice Creams with Chocolate Cookie Swirls & Gobs of Chocolate Chip Cookie Dough & Peanut Butter Cookie Dough.	https://www.benjerry.com/files/live/sites/systemsite/files/flavors/products/us/pint/open-closed-pints/tonight-dough-landing-open.png
Totally Unbaked™	Chocolate & Vanilla Ice Creams with Brownie Batter Swirls & Gobs of Chocolate Chip Cookie Dough	https://www.benjerry.com/files/live/sites/systemsite/files/flavors/products/us/pint/open-closed-pints/totally-unbaked-landing-open.png
Triple Caramel Chunk®	Caramel Ice Cream with a Swirl of Caramel & Fudge-Covered Caramel Chunks	https://www.benjerry.com/files/live/sites/systemsite/files/flavors/products/us/pint/open-closed-pints/triple-caramel-chunk-landing-open.png
Vanilla	Vanilla Ice Cream	https://www.benjerry.com/files/live/sites/systemsite/files/flavors/products/us/pint/open-closed-pints/vanilla-landing-open.png
Vanilla Caramel Fudge	Vanilla Ice Cream with Swirls of Caramel & Fudge	https://www.benjerry.com/files/live/sites/systemsite/files/flavors/products/us/pint/open-closed-pints/vanilla-caramel-fudge-landing-open-2019.png
Boom Chocolatta™ Cookie Core	Mocha & Caramel Ice Creams with Chocolate Cookies, Fudge Flakes & a Chocolate Cookie Core	https://www.benjerry.com/files/live/sites/systemsite/files/flavors/products/us/pint/open-closed-pints/boom-chocolatta-core-landing-2019.png
Chocolate Chip Cookie Dough Core	Cookie Milk Ice Cream with Fudge Chips & a Chocolate Chip Cookie Dough Core 	https://www.benjerry.com/files/live/sites/systemsite/files/flavors/products/us/pint/open-closed-pints/chocolate-chip-cookie-dough-core-landing.png
Wake & " No Bake "  Cookie Dough Core	Vanilla Ice Cream with Peanut Butter Cookies, Peanut Butter Ice Cream with Fudge Chips & a No Bake Cookie Dough Core 	https://www.benjerry.com/files/live/sites/systemsite/files/flavors/products/us/pint/open-closed-pints/wake-no-bake-core-landing.png
Brownie Batter Core	Chocolate & Vanilla Ice Creams with Fudge Brownies & a Brownie Batter Core	https://www.benjerry.com/files/live/sites/systemsite/files/flavors/products/us/pint/open-closed-pints/brownie-batter-core-landing-2019.png
Cookies & Cream Cheesecake Core	Chocolate & Cheesecake Ice Creams with Chocolate Cookies & a Cheesecake Core	https://www.benjerry.com/files/live/sites/systemsite/files/flavors/products/us/pint/open-closed-pints/cookies-and-cream-cheesecake-landing.png
Karamel Sutra® Core	Chocolate & Caramel Ice Creams with Fudge Chips & a Soft Caramel Core	https://www.benjerry.com/files/live/sites/systemsite/files/flavors/products/us/pint/open-closed-pints/karamel-sutra-landing.png
Peanut Butter Fudge Core	Chocolate & Peanut Butter Ice Creams with Mini Peanut Butter Cups & a Peanut Butter Fudge Core	https://www.benjerry.com/files/live/sites/systemsite/files/flavors/products/us/pint/open-closed-pints/peanut-butter-fudge-landing.png
Salted Caramel Core	Sweet Cream Ice Cream with Blonde Brownies & a Salted Caramel Core	https://www.benjerry.com/files/live/sites/systemsite/files/flavors/products/us/pint/open-closed-pints/salted-caramel-landing.png
Chocolate Caramel Cookie Dough	Chocolate Ice Cream with Caramel Swirls & Gobs of Chocolate Chip Cookie Dough Topped with Caramel Cups & Chocolatey Ganache	https://www.benjerry.com/files/live/sites/systemsite/files/flavors/products/us/pint/open-closed-pints/chocolate-caramel-cookie-dough-topped-landing-open.png
PB Over the Top	Chocolate Ice Cream with Peanut Butter Swirls & Peanut Butter Cups Topped with Mini Peanut Butter Cups & Chocolatey Ganache	https://www.benjerry.com/files/live/sites/systemsite/files/flavors/products/us/pint/open-closed-pints/pb-over-the-top-topped-landin-open.png
Salted Caramel Brownie	Vanilla Ice Cream with Salted Caramel Swirls ＆ Fudge Brownies Topped with Caramel Cups ＆ Chocolatey Ganache	https://www.benjerry.com/files/live/sites/systemsite/files/flavors/products/us/pint/open-closed-pints/salted-caramel-brownie-topped-landing-open.png
Strawberry Topped Tart	Sweet Cream Ice Cream with Strawberry Swirls & Pie Crust Pieces Topped with White Chocolatey Ganache & Candy Sprinkles	https://www.benjerry.com/files/live/sites/systemsite/files/flavors/products/us/pint/open-closed-pints/strawbery-tart-topped-landing-open.png
Thick Mint	Mint Ice Cream with Chocolate Cookie Swirls & Mint Chocolate Cookie Balls Topped with Chocolate Cookies & Chocolatey Ganache	https://www.benjerry.com/files/live/sites/systemsite/files/flavors/products/us/pint/open-closed-pints/thick-mint-topped-landing-open.png
Tiramisu	Mascarpone Ice Cream with Fudge Swirls & Shortbread Pieces Topped with Espresso Fudge Chunks & Chocolatey Ganache	https://www.benjerry.com/files/live/sites/systemsite/files/flavors/products/us/pint/open-closed-pints/tiramisu-topped-landing-open.png
Whiskey Biz™	Brown Butter Bourbon Ice Cream with Blonde Brownies & Whiskey Caramel Swirls Topped with White Chocolatey Ganache & White Fudge Chunks	https://www.benjerry.com/files/live/sites/systemsite/files/flavors/products/us/pint/open-closed-pints/whiskey-biz-topped-landing-open.png
